{
  "version": "table_context_v1",
  "table_id": "p4_t04.xlsx",
  "source_hash": "2e19844b56d0879972be69d6bfa5feae75a23d55c7f671557b8d434c74562a55",
  "metadata": {
    "date_system": "1900",
    "fixture": true,
    "parsed_integrated": false,
    "note": "Public Q006 contract fixture. Physical cells retained; semantic paths hand-annotated only for E25/E26. Not parser output."
  },
  "sheets": [
    {
      "name": "cpsaat07",
      "visibility": "visible",
      "dimensions": "A1:I68",
      "raw_rows": null,
      "parsed_cells": [
        {
          "sheet": "cpsaat07",
          "cell": "A1",
          "row_index": 1,
          "column_index": 1,
          "value_raw": "HOUSEHOLD DATA\nANNUAL AVERAGES\n7. Employment status of the civilian noninstitutional population 25 years and over by educational attainment, sex, race, and Hispanic or Latino ethnicity",
          "value_type": "string",
          "display_value": "HOUSEHOLD DATA\nANNUAL AVERAGES\n7. Employment status of the civilian noninstitutional population 25 years and over by educational attainment, sex, race, and Hispanic or Latino ethnicity",
          "unit": null,
          "formula": null,
          "section_path": [],
          "row_header_path": [],
          "column_header_path": []
        },
        {
          "sheet": "cpsaat07",
          "cell": "A2",
          "row_index": 2,
          "column_index": 1,
          "value_raw": "[Numbers in thousands]",
          "value_type": "string",
          "display_value": "[Numbers in thousands]",
          "unit": null,
          "formula": null,
          "section_path": [],
          "row_header_path": [],
          "column_header_path": []
        },
        {
          "sheet": "cpsaat07",
          "cell": "A3",
          "row_index": 3,
          "column_index": 1,
          "value_raw": "",
          "value_type": "string",
          "display_value": "",
          "unit": null,
          "formula": null,
          "section_path": [],
          "row_header_path": [],
          "column_header_path": []
        },
        {
          "sheet": "cpsaat07",
          "cell": "A4",
          "row_index": 4,
          "column_index": 1,
          "value_raw": "Employment status,\n sex, race, and Hispanic\n or Latino ethnicity",
          "value_type": "string",
          "display_value": "Employment status,\n sex, race, and Hispanic\n or Latino ethnicity",
          "unit": null,
          "formula": null,
          "section_path": [],
          "row_header_path": [],
          "column_header_path": []
        },
        {
          "sheet": "cpsaat07",
          "cell": "B4",
          "row_index": 4,
          "column_index": 2,
          "value_raw": 2023,
          "value_type": "number",
          "display_value": "2023",
          "unit": null,
          "formula": null,
          "section_path": [],
          "row_header_path": [],
          "column_header_path": []
        },
        {
          "sheet": "cpsaat07",
          "cell": "B5",
          "row_index": 5,
          "column_index": 2,
          "value_raw": "Less than a\nhigh school\ndiploma",
          "value_type": "string",
          "display_value": "Less than a\nhigh school\ndiploma",
          "unit": null,
          "formula": null,
          "section_path": [],
          "row_header_path": [],
          "column_header_path": []
        },
        {
          "sheet": "cpsaat07",
          "cell": "C5",
          "row_index": 5,
          "column_index": 3,
          "value_raw": "High school\ngraduates,\nno college(1)",
          "value_type": "string",
          "display_value": "High school\ngraduates,\nno college(1)",
          "unit": null,
          "formula": null,
          "section_path": [],
          "row_header_path": [],
          "column_header_path": []
        },
        {
          "sheet": "cpsaat07",
          "cell": "D5",
          "row_index": 5,
          "column_index": 4,
          "value_raw": "Some college or associate degree",
          "value_type": "string",
          "display_value": "Some college or associate degree",
          "unit": null,
          "formula": null,
          "section_path": [],
          "row_header_path": [],
          "column_header_path": []
        },
        {
          "sheet": "cpsaat07",
          "cell": "G5",
          "row_index": 5,
          "column_index": 7,
          "value_raw": "Bachelor's degree and higher",
          "value_type": "string",
          "display_value": "Bachelor's degree and higher",
          "unit": null,
          "formula": null,
          "section_path": [],
          "row_header_path": [],
          "column_header_path": []
        },
        {
          "sheet": "cpsaat07",
          "cell": "D6",
          "row_index": 6,
          "column_index": 4,
          "value_raw": "Total",
          "value_type": "string",
          "display_value": "Total",
          "unit": null,
          "formula": null,
          "section_path": [],
          "row_header_path": [],
          "column_header_path": []
        },
        {
          "sheet": "cpsaat07",
          "cell": "E6",
          "row_index": 6,
          "column_index": 5,
          "value_raw": "Some college,\nno degree",
          "value_type": "string",
          "display_value": "Some college,\nno degree",
          "unit": null,
          "formula": null,
          "section_path": [],
          "row_header_path": [],
          "column_header_path": []
        },
        {
          "sheet": "cpsaat07",
          "cell": "F6",
          "row_index": 6,
          "column_index": 6,
          "value_raw": "Associate\ndegree",
          "value_type": "string",
          "display_value": "Associate\ndegree",
          "unit": null,
          "formula": null,
          "section_path": [],
          "row_header_path": [],
          "column_header_path": []
        },
        {
          "sheet": "cpsaat07",
          "cell": "G6",
          "row_index": 6,
          "column_index": 7,
          "value_raw": "Total(2)",
          "value_type": "string",
          "display_value": "Total(2)",
          "unit": null,
          "formula": null,
          "section_path": [],
          "row_header_path": [],
          "column_header_path": []
        },
        {
          "sheet": "cpsaat07",
          "cell": "H6",
          "row_index": 6,
          "column_index": 8,
          "value_raw": "Bachelor's\ndegree\nonly",
          "value_type": "string",
          "display_value": "Bachelor's\ndegree\nonly",
          "unit": null,
          "formula": null,
          "section_path": [],
          "row_header_path": [],
          "column_header_path": []
        },
        {
          "sheet": "cpsaat07",
          "cell": "I6",
          "row_index": 6,
          "column_index": 9,
          "value_raw": "Advanced\ndegree",
          "value_type": "string",
          "display_value": "Advanced\ndegree",
          "unit": null,
          "formula": null,
          "section_path": [],
          "row_header_path": [],
          "column_header_path": []
        },
        {
          "sheet": "cpsaat07",
          "cell": "A7",
          "row_index": 7,
          "column_index": 1,
          "value_raw": "",
          "value_type": "string",
          "display_value": "",
          "unit": null,
          "formula": null,
          "section_path": [],
          "row_header_path": [],
          "column_header_path": []
        },
        {
          "sheet": "cpsaat07",
          "cell": "A8",
          "row_index": 8,
          "column_index": 1,
          "value_raw": "TOTAL",
          "value_type": "string",
          "display_value": "TOTAL",
          "unit": null,
          "formula": null,
          "section_path": [],
          "row_header_path": [],
          "column_header_path": []
        },
        {
          "sheet": "cpsaat07",
          "cell": "A9",
          "row_index": 9,
          "column_index": 1,
          "value_raw": "Civilian noninstitutional population",
          "value_type": "string",
          "display_value": "Civilian noninstitutional population",
          "unit": null,
          "formula": null,
          "section_path": [],
          "row_header_path": [],
          "column_header_path": []
        },
        {
          "sheet": "cpsaat07",
          "cell": "B9",
          "row_index": 9,
          "column_index": 2,
          "value_raw": 19480,
          "value_type": "number",
          "display_value": "19480",
          "unit": null,
          "formula": null,
          "section_path": [],
          "row_header_path": [],
          "column_header_path": []
        },
        {
          "sheet": "cpsaat07",
          "cell": "C9",
          "row_index": 9,
          "column_index": 3,
          "value_raw": 63419,
          "value_type": "number",
          "display_value": "63419",
          "unit": null,
          "formula": null,
          "section_path": [],
          "row_header_path": [],
          "column_header_path": []
        },
        {
          "sheet": "cpsaat07",
          "cell": "D9",
          "row_index": 9,
          "column_index": 4,
          "value_raw": 56926,
          "value_type": "number",
          "display_value": "56926",
          "unit": null,
          "formula": null,
          "section_path": [],
          "row_header_path": [],
          "column_header_path": []
        },
        {
          "sheet": "cpsaat07",
          "cell": "E9",
          "row_index": 9,
          "column_index": 5,
          "value_raw": 32847,
          "value_type": "number",
          "display_value": "32847",
          "unit": null,
          "formula": null,
          "section_path": [],
          "row_header_path": [],
          "column_header_path": []
        },
        {
          "sheet": "cpsaat07",
          "cell": "F9",
          "row_index": 9,
          "column_index": 6,
          "value_raw": 24079,